tag	year	Title	Website	Status	motivation	type	shift locus	data shift	shift source	task	Annotator 1	Annotator 2	Notes															
mhamdi-etal-2021-x	2021	{X}-{METRA}-{ADA}: Cross-lingual Meta-Transfer learning Adaptation to Natural Language Understanding and Question Answering	https://aclanthology.org/2021.naacl-main.283	Done	practical	across language	finetune-train/test	covariate	natural data splits	NLU	Mikel	Rita	Typical zero-shot and few-shot cross-lingual transfer setup with no or few training examples in the target language. The paper focuses on the latter scenario with a metalearning approach, and the zero-shot transfer results are reported for reference															
saha-etal-2021-multiprover	2021	multi{PR}over: Generating Multiple Proofs for Improved Interpretability in Rule Reasoning	https://aclanthology.org/2021.naacl-main.287	Done	cognitive	across domain	train-test	covariate	fully generated/selected	reasoning	Rita	Dennis	Fully synthetic data for DU0-DU5 															
saha-etal-2021-multiprover	2021	multi{PR}over: Generating Multiple Proofs for Improved Interpretability in Rule Reasoning	https://aclanthology.org/2021.naacl-main.287	Done	cognitive	across domain	train-test	covariate	naturally occurring shifts	reasoning	Rita	Dennis	Birds electricity and para rules dataset															
kavumba-etal-2021-learning	2021	Learning to Learn to be Right for the Right Reasons	https://aclanthology.org/2021.naacl-main.304	Done	practical	robustness	finetune-train/test	covariate	natural data splits	reasoning	Dieuwke	Janie	Metalearning during finetuning, comparing easy and hard examples															
kachuee-etal-2021-self	2021	Self-Supervised Contrastive Learning for Efficient User Satisfaction Prediction in Conversational Agents	https://aclanthology.org/2021.naacl-main.319	Done	cognitive	compositional	train-test	covariate	generated shifts	sentiment analysis	Dieuwke	Zhijing																
allaway-etal-2021-adversarial	2021	Adversarial Learning for Zero-Shot Stance Detection on Social Media	https://aclanthology.org/2021.naacl-main.379	Done	cognitive	across domain	train-test	covariate	natural data splits	text classification	Rita	Huygaa	Stance detection task (political classification) with adversarial learning and zero-shot testing															
silfverberg-etal-2021-rnn	2021	Do RNN States Encode Abstract Phonological Alternations?	https://aclanthology.org/2021.naacl-main.435	Done	cognitive	structural	train-test	covariate	fully generated/selected	morphological inflection	Rita	Huygaa	Task to evaluate capability of RNNs to discovetr phonological alterations in Finnish by exploring whether hidden states encode them															
chen-etal-2021-shadowgnn	2021	{S}hadow{GNN}: Graph Projection Neural Network for Text-to-{SQL} Parser	https://aclanthology.org/2021.naacl-main.441	Flag for further review	cognitive	compositional	train-test	assumed	generated shifts	semantic parsing / role labelling	Rita	Koustuv																
yu-etal-2021-adaptsum	2021	{A}dapt{S}um: Towards Low-Resource Domain Adaptation for Abstractive Summarization	https://aclanthology.org/2021.naacl-main.471	First check done	practical	across domain	pretrain-train	label	naturally occurring shifts	summarisation	Rita	Yanai	Summarisation accross different domains on finetuned model															
liu-etal-2021-lexical	2021	Lexical Semantic Recognition	https://aclanthology.org/2021.mwe-1.6	Done	intrinsic	across domain	train-test	covariate	natural data splits	semantic parsing / role labelling	Rita	Dieuwke	Lexical semantic supertagging across different corpora, that are considered out of domain according to the authors (see sec 3.1)															
adelani-etal-2021-effect	2021	The Effect of Domain and Diacritics in {Y}oruba{--}{E}nglish Neural Machine Translation	https://aclanthology.org/2021.mtsummit-research.6	Done	practical	across domain	pretrain-test	covariate	natural data splits	machine translation	Rita	Huygaa	OPUS-MT, Google GMNMT, Facebook M2M-100 models were tested on new domain data															
adelani-etal-2021-effect	2021	The Effect of Domain and Diacritics in {Y}oruba{--}{E}nglish Neural Machine Translation	https://aclanthology.org/2021.mtsummit-research.6	Done	practical	across domain	all	covariate	natural data splits	machine translation	Rita	Huygaa	Cross-domain machine translation testing															
phung-etal-2021-learning	2021	Learning Cross-lingual Representations for Event Coreference Resolution with Multi-view Alignment and Optimal Transport	https://aclanthology.org/2021.mrl-1.6	Flag for further review	cognitive	across language	finetune-train/test	full	naturally occurring shifts	multiple tasks	Rita	Yanai																
han-lundin-2021-multi	2021	Multi-Pair Text Style Transfer for Unbalanced Data via Task-Adaptive Meta-Learning	https://aclanthology.org/2021.metanlp-1.4	Flag for further review	cognitive	across task	finetune-train/test	covariate	natural data splits	paraphrasing	Rita	Yanai	Style-transfer using pretrained models and meta-learning															
cattan-etal-2021-cross	2021	On the cross-lingual transferability of multilingual prototypical models across {NLU} tasks	https://aclanthology.org/2021.metanlp-1.5	Done	practical	across language	finetune-train/test	covariate	natural data splits	NLU	Mikel	Rita	Typical cross-lingual transfer setup (train on all languages or all languages but target)															
li-zhang-2021-semi	2021	Semi-supervised Meta-learning for Cross-domain Few-shot Intent Classification	https://aclanthology.org/2021.metanlp-1.8	First check done	cognitive	across domain	finetune-train/test	covariate	generated shifts	intent classification	Rita		Improvement of generalization capability of intent classification task through meta learning applications. Application of masking on datasets.															
pradeep-etal-2021-scientific	2021	Scientific Claim Verification with {V}er{T}5erini	https://aclanthology.org/2021.louhi-1.11	First check done	cognitive	across domain	train-test	covariate	generated shifts	reasoning	Rita		Task: reasoning, fact verification. zero-shot setup															
vilar-federico-2021-statistical	2021	A Statistical Extension of Byte-Pair Encoding	https://aclanthology.org/2021.iwslt-1.31	Flag for further review		compositional	train-test		generated shifts	other	Rita		The article describes improvement in byte pair enccoding and then it application in MT models, so I am not sure if it should be included. Please confirm.															
zhou-etal-2021-encoding	2021	Encoding Explanatory Knowledge for Zero-shot Science Question Answering	https://aclanthology.org/2021.iwcs-1.5	First check done	practical	across domain	all	covariate	natural data splits	question answering	Rita																	
gung-palmer-2021-predicate	2021	Predicate Representations and Polysemy in {V}erb{N}et Semantic Parsing	https://aclanthology.org/2021.iwcs-1.6	First check done	practical	across domain	finetune-train/test	covariate	natural data splits	semantic parsing / role labelling	Huygaa		Table 4															
betz-etal-2021-critical	2021	Critical Thinking for Language Models	https://aclanthology.org/2021.iwcs-1.7	First check done	cognitive	across domain	finetune-train/test	label	fully generated/selected	reasoning	Rita		NLI, reasoning task with fully generated training, eval datasets finetuned on GPT2															
falk-etal-2021-automatic	2021	Automatic Classification of Attributes in {G}erman Adjective-Noun Phrases	https://aclanthology.org/2021.iwcs-1.23	First check done	intrinsic	structural	finetune-train/test	label	fully generated/selected	text classification	Rita		Adjective attributes classification with augmented datasets with Bert and FastText															
zhou-tan-2021-investigating	2021	Investigating the Effect of Natural Language Explanations on Out-of-Distribution Generalization in Few-shot {NLI}	https://aclanthology.org/2021.insights-1.17	Done	cognitive	across domain	pretrain-train	covariate	generated shifts	NLI	Rita	Kaiser	NLI taskn with multiple generated OOD templates , since there are different combinations or templates and vocabs I checked data shift as double															                           
bhargava-etal-2021-generalization	2021	Generalization in NLI: Ways (Not) To Go Beyond Simple Heuristics	https://aclanthology.org/2021.insights-1.18	Flag for further review	cognitive	across domain	pretrain-train	covariate	generated shifts	NLI	Rita	Kaiser	Improving generalization in NLI by data shifts in pretrained models tested on two generated datasets HANS and MNLI Added by Kaiser: They fine-tune the models on MNLI and then evaluate it on HANS, so I think the locus should be more of finetune-test and the generalization is in the context of robustness,															
conforti-etal-2021-adversarial	2021	Adversarial Training for News Stance Detection: Leveraging Signals from a Multi-Genre Corpus.	https://aclanthology.org/2021.hackashop-1.1	First check done	practical	across domain	pretrain-train	label	naturally occurring shifts	intent classification	Rita		Task: news stance detection (I mark intent classification) within the same domain but different genres (i.e. twitter or news), because of that I decided to use domain shift (feel free to double check)															
pelicon-etal-2021-zero	2021	Zero-shot Cross-lingual Content Filtering: Offensive Language and Hate Speech Detection	https://aclanthology.org/2021.hackashop-1.5	Flag for further review	practical	across language	finetune-train/test	covariate	natural data splits	hate speech detection	Mikel		Typical zero-shot cross-lingual transfer setup (train on English, evaluate in target language). Unsure about the motivation: the tasks are offensive language and hate speech detection (which seem related to fairness) but the exploration in the paper around cross-lingual generalization seems more practically motivated															
wang-etal-2021-evaluating	2021	Evaluating Text Generation from Discourse Representation Structures	https://aclanthology.org/2021.gem-1.8	Flag for further review	intrinsic	structural	train-test	assumed	generated shifts	NLG	Mario	Rita	tense, polarity, and grammatical number															
wang-etal-2021-evaluating	2021	Evaluating Text Generation from Discourse Representation Structures	https://aclanthology.org/2021.gem-1.8	Flag for further review	intrinsic	robustness	train-test	covariate	generated shifts	NLG	Mario	Rita	unseen names and quantities															
jin-etal-2021-learn-continually	2021	Learn Continually, Generalize Rapidly: Lifelong Knowledge Accumulation for Few-shot Learning	https://aclanthology.org/2021.findings-emnlp.62	Done	cognitive	across task	train-test	full	naturally occurring shifts	multiple tasks	Leila	Yanai	instant performance and final performance															
jin-etal-2021-learn-continually	2021	Learn Continually, Generalize Rapidly: Lifelong Knowledge Accumulation for Few-shot Learning	https://aclanthology.org/2021.findings-emnlp.62	Done	cognitive	across task	pretrain-test	full	naturally occurring shifts	multiple tasks	Leila	Yanai	few shot performnace															
jin-etal-2021-learn-continually	2021	Learn Continually, Generalize Rapidly: Lifelong Knowledge Accumulation for Few-shot Learning	https://aclanthology.org/2021.findings-emnlp.62	Done	cognitive	across task	pretrain-train	full	naturally occurring shifts	multiple tasks	Leila	Yanai	few shot performnace															
li-etal-2021-select-one	2021	How to Select One Among All ? An Empirical Study Towards the Robustness of Knowledge Distillation in Natural Language Understanding	https://aclanthology.org/2021.findings-emnlp.65	First check done	intrinsic	across domain	train-test	covariate	naturally occurring shifts	multiple tasks	Leila	Yanai	OOD testing on various Knowledge distillation methods (paraphrasing/NLI)															
li-etal-2021-select-one	2021	How to Select One Among All ? An Empirical Study Towards the Robustness of Knowledge Distillation in Natural Language Understanding	https://aclanthology.org/2021.findings-emnlp.65	First check done	intrinsic	robustness	train-test	covariate	generated shifts	multiple tasks	Leila	Yanai	Adverserail testing on KD methods (parphrasing/NLI/sentiment analysis/linguistic acceptability/regression/QA)															
yoo-qi-2021-towards-improving	2021	Towards Improving Adversarial Training of {NLP} Models	https://aclanthology.org/2021.findings-emnlp.81	Done	practical	robustness	train-test	covariate	generated shifts	text classification	Leila	Yanai	aims to increase robustness by adverserail attack and shows it has generalisation opver unseen attacks and ood data in the target task															
yoo-qi-2021-towards-improving	2021	Towards Improving Adversarial Training of {NLP} Models	https://aclanthology.org/2021.findings-emnlp.81	Done	practical	robustness	train-test	covariate	naturally occurring shifts	text classification	Leila	Yanai	aims to increase robustness by adverserail attack and shows it has generalisation opver unseen attacks and ood data in the target task															
yoo-qi-2021-towards-improving	2021	Towards Improving Adversarial Training of {NLP} Models	https://aclanthology.org/2021.findings-emnlp.81	Done	practical	across domain	train-test	covariate	naturally occurring shifts	text classification	Leila	Yanai	aims to increase robustness by adverserail attack and shows it has generalisation opver unseen attacks and ood data in the target task															
sung-etal-2021-cnnbif-cnn	2021	{CNNB}i{F}: {CNN}-based Bigram Features for Named Entity Recognition	https://aclanthology.org/2021.findings-emnlp.87																									
zheng-lapata-2021-compositional-generalization	2021	Compositional Generalization via Semantic Tagging	https://aclanthology.org/2021.findings-emnlp.88																									
zhang-etal-2021-effectiveness-pre	2021	Effectiveness of Pre-training for Few-shot Intent Classification	https://aclanthology.org/2021.findings-emnlp.96	Flag for further review	practical	across domain	pretrain-test	full	naturally occurring shifts	intent classification	Leila	Koustuv	Finetunes BERT on labled intent data and then few shots over different intent domains															
lee-2021-improving-end	2021	Improving End-to-End Task-Oriented Dialog System with A Simple Auxiliary Task	https://aclanthology.org/2021.findings-emnlp.112	Flag for further review	practical	across domain	train-test	full	natural data splits	dialogue	Leila	Koustuv	For task oriented dialogue they use and auxiliary task to better do TOD. In this part I cant say where the generalization is. But they have OOD testing with fewshot finetuning. 															
zhong-etal-2021-wikibias-detecting	2021	{WIKIBIAS}: Detecting Multi-Span Subjective Biases in Language	https://aclanthology.org/2021.findings-emnlp.155																									
gai-etal-2021-grounded-graph	2021	Grounded Graph Decoding improves Compositional Generalization in Question Answering	https://aclanthology.org/2021.findings-emnlp.157																									
shrivastava-etal-2021-span-pointer	2021	Span Pointer Networks for Non-Autoregressive Task-Oriented Semantic Parsing	https://aclanthology.org/2021.findings-emnlp.161																									
hu-etal-2021-relation-guided	2021	Relation-Guided Pre-Training for Open-Domain Question Answering	https://aclanthology.org/2021.findings-emnlp.292	Done	practical	across domain	pretrain-train	covariate	naturally occurring shifts	question answering	Leila	Koustuv	Creates a QA dataset from wikipedia articles to address low relation coverage, pretrain QA system on this dataset and then finestunes and test over three QA datasets.															
shuster-etal-2021-retrieval-augmentation	2021	Retrieval Augmentation Reduces Hallucination in Conversation	https://aclanthology.org/2021.findings-emnlp.320																									
picco-etal-2021-neural-unification	2021	Neural Unification for Logic Reasoning over Natural Language	https://aclanthology.org/2021.findings-emnlp.331																									
wullach-etal-2021-fight-fire	2021	Fight Fire with Fire: Fine-tuning Hate Detectors using Large Samples of Generated Hate Speech	https://aclanthology.org/2021.findings-emnlp.402	Done	practical	across domain	finetune-train/test	covariate	naturally occurring shifts	hate speech detection	Verna	Zhijing	Technically it's across dataset generalisation, but in the process it's also across domain, because the different datasets have slightly different domains. Pretrained models are rather similar (BERT, Roberta, ALBERT) so I'm not marking the pretrain shift, which is not at all the focus.															
lent-etal-2021-testing	2021	Testing Cross-Database Semantic Parsers With Canonical Utterances	https://aclanthology.org/2021.eval4nlp-1.8																									
zou-etal-2021-low	2021	Low-Resource Dialogue Summarization with Domain-Agnostic Multi-Source Pretraining	https://aclanthology.org/2021.emnlp-main.7		practical	robustness	all	full	naturally occurring shifts	summarisation	Janie		maybe there should be a second row since they also test not full															
sen-etal-2021-counterfactually	2021	How Does Counterfactually Augmented Data Impact Models for Social Computing Constructs?	https://aclanthology.org/2021.emnlp-main.28	Done	practical	across domain	finetune-train/test	full	naturally occurring shifts	text classification	Leila	Koustuv																
sen-etal-2021-counterfactually	2021	How Does Counterfactually Augmented Data Impact Models for Social Computing Constructs?	https://aclanthology.org/2021.emnlp-main.28	Done	practical	robustness	finetune-train/test	label	generated shifts	text classification	Leila	Koustuv	They perform the above but with adverserial samples made from the original data (sentiment, sexisem, and hate speech)															
csordas-etal-2021-devil	2021	The Devil is in the Detail: Simple Tricks Improve Systematic Generalization of Transformers	https://aclanthology.org/2021.emnlp-main.49	Done	practical	robustness	train-test	covariate	generated shifts	seq2seq synthetic	Yanai	Verna																
rivera-soto-etal-2021-learning	2021	Learning Universal Authorship Representations	https://aclanthology.org/2021.emnlp-main.70								Janie																	
wei-etal-2021-frequency	2021	Frequency Effects on Syntactic Rule Learning in Transformers	https://aclanthology.org/2021.emnlp-main.72	Done	practical	structural	pretrain-test	covariate	natural data splits	diagnostic task	Tiago	Dieuwke	This paper evaluates the impact of verb frequencies in BERT's pretraining data on its ability to do number agreement. I wasnt sure if this means we should have train-test or pretrain-test in this case. I annotated it as train--test, since BERT's "pretraining data" is treated as train data here.															
weber-etal-2021-extend	2021	Extend, don’t rebuild: Phrasing conditional graph modification as autoregressive sequence labelling	https://aclanthology.org/2021.emnlp-main.93																									
perez-mayos-etal-2021-much	2021	How much pretraining data do language models need to learn syntax?	https://aclanthology.org/2021.emnlp-main.118	Done	practical	across task	pretrain-train	full	naturally occurring shifts	multiple tasks	Leila	Koustuv	They investigate how much learning with bigger data helps a LM in downstream tasks (POS tagging/semantic parsing/paraphrase detection)															
perez-mayos-etal-2021-much	2021	How much pretraining data do language models need to learn syntax?	https://aclanthology.org/2021.emnlp-main.118	Flag for further review	intrinsic	across task	pretrain-test	full	naturally occurring shifts	syntactic tests	Koustuv	Tiago	Probing task															
perez-mayos-etal-2021-much	2021	How much pretraining data do language models need to learn syntax?	https://aclanthology.org/2021.emnlp-main.118	Flag for further review	intrinsic	across task	pretrain-test	full	naturally occurring shifts	syntactic tests	Koustuv	Tiago	Syntactic Generalization															
huang-etal-2021-improving-zero	2021	Improving Zero-Shot Cross-Lingual Transfer Learning via Robust Training	https://aclanthology.org/2021.emnlp-main.126	Done	practical	across language	finetune-train/test	covariate	natural data splits	multitask	Mikel	Leila	This paper proposes an approach to improve multilingual BERT and evaluates on the typical zero-shot cross-lingualt transfer setup															
bari-etal-2021-nearest	2021	Nearest Neighbour Few-Shot Learning for Cross-lingual Classification	https://aclanthology.org/2021.emnlp-main.131	Done	practical	across language	finetune-train/test	full	natural data splits	multiple tasks	Leila	Koustuv	They finetune a multilingual LM on English data of a certain task and then few shot (wo change of parameters) with other languages in the same task															
bari-etal-2021-nearest	2021	Nearest Neighbour Few-Shot Learning for Cross-lingual Classification	https://aclanthology.org/2021.emnlp-main.131	Done	practical	across task	finetune-train/test	full	natural data splits	paraphrase detection	Leila	Koustuv	Here they perform the above procedure but also perform on a different task															
wu-etal-2021-dialki	2021	{DIALKI}: Knowledge Identification in Conversational Systems through Dialogue-Document Contextualization	https://aclanthology.org/2021.emnlp-main.140																									
tian-etal-2021-diagnosing	2021	Diagnosing the First-Order Logical Reasoning Ability Through {L}ogic{NLI}	https://aclanthology.org/2021.emnlp-main.303	Done	intrinsic	robustness	all	double	generated shifts	reasoning	Yanai	Dieuwke	Investigate how well different pretrained models generalise to a newly proposed first-order-logic reasoning dataset. Because there are different step setup in the FOL stage, this paper is marked to investigate a multi-locus double shift. the training/val/test data of that dataset itself, so the experiments are marked "label shift" with as locus pretrain to test															
ma-etal-2021-exploring	2021	Exploring Strategies for Generalizable Commonsense Reasoning with Pre-trained Models	https://aclanthology.org/2021.emnlp-main.445																									
bau-andreas-2021-neural	2021	How Do Neural Sequence Models Generalize? Local and Global Cues for Out-of-Distribution Prediction	https://aclanthology.org/2021.emnlp-main.448																									
gupta-etal-2021-paired	2021	Paired Examples as Indirect Supervision in Latent Decision Models	https://aclanthology.org/2021.emnlp-main.466																									
aghajanyan-etal-2021-muppet	2021	Muppet: Massive Multi-task Representations with Pre-Finetuning	https://aclanthology.org/2021.emnlp-main.468	Flag for further review	practical	across task	pretrain-train	full	naturally occurring shifts	multiple tasks	Leila	Koustuv	They add a new training stage called pre-finetuning with huge amount of data on a number of enormous tasks. This stage is after pretraining, before finetuning (for task-specific knowledge).															
friedman-etal-2021-single	2021	Single-dataset Experts for Multi-dataset Question Answering	https://aclanthology.org/2021.emnlp-main.495	Done	practical	across domain	finetune-train/test	covariate	naturally occurring shifts	question answering	Leila	Koustuv	This model consists of adaptor networks, where multiple adaptors are trained over multiple tasks. So, in one adaptor case the shift locus is pre-train-train, but for all of them combined the locus in finetune train-test.															
jiang-bansal-2021-inducing	2021	Inducing Transformer{'}s Compositional Generalization Ability via Auxiliary Sequence Prediction Tasks	https://aclanthology.org/2021.emnlp-main.505																									
zuo-etal-2021-adversarial	2021	Adversarial Regularization as Stackelberg Game: An Unrolled Optimization Approach	https://aclanthology.org/2021.emnlp-main.527																									
longpre-etal-2021-entity	2021	Entity-Based Knowledge Conflicts in Question Answering	https://aclanthology.org/2021.emnlp-main.565																									
ye-etal-2021-crossfit	2021	{C}ross{F}it: A Few-shot Learning Challenge for Cross-task Generalization in {NLP}	https://aclanthology.org/2021.emnlp-main.572	Done	practical	across task	pretrain-train	full	natural data splits	multitask	Huygaa	Koustuv	Held-out-NLI experiments															
ye-etal-2021-crossfit	2021	{C}ross{F}it: A Few-shot Learning Challenge for Cross-task Generalization in {NLP}	https://aclanthology.org/2021.emnlp-main.572	Done	practical	across task	all	double	natural data splits	multitask	Huygaa	Koustuv	Random Split experiments															
dalvi-etal-2021-explaining	2021	Explaining Answers with Entailment Trees	https://aclanthology.org/2021.emnlp-main.585																									
zhang-choi-2021-situatedqa	2021	{S}ituated{QA}: Incorporating Extra-Linguistic Contexts into {QA}	https://aclanthology.org/2021.emnlp-main.586	Done	intrinsic	compositional	pretrain-test	covariate	fully generated/selected	question answering	Huygaa	Leila	Table 5, row 1,2,4,5 (unmodified, query modified baselines)															
zhang-choi-2021-situatedqa	2021	{S}ituated{QA}: Incorporating Extra-Linguistic Contexts into {QA}	https://aclanthology.org/2021.emnlp-main.586	Done	intrinsic	compositional	pretrain-train	full	fully generated/selected	question answering	Huygaa	Leila	Table 5, row 3,6 finetuned BERT															
zhou-etal-2021-rica	2021	{RICA}: Evaluating Robust Inference Capabilities Based on Commonsense Axioms	https://aclanthology.org/2021.emnlp-main.598																									
lin-etal-2021-zero	2021	Zero-Shot Dialogue State Tracking via Cross-Task Transfer	https://aclanthology.org/2021.emnlp-main.622																									
chen-etal-2021-honey	2021	Honey or Poison? Solving the Trigger Curse in Few-shot Event Detection via Causal Intervention	https://aclanthology.org/2021.emnlp-main.637																									
yu-joty-2021-effective	2021	Effective Fine-Tuning Methods for Cross-lingual Adaptation	https://aclanthology.org/2021.emnlp-main.668																									
