tag	year	Title	Website	Status	motivation	type	shift locus	data shift	shift source	task	Annotator 1	Annotator 2	Notes															
kobayashi-etal-2020-efficient	2020	Efficient Estimation of Influence of a Training Instance	https://aclanthology.org/2020.sustainlp-1.6																									
mishra-sachdeva-2020-need	2020	Do We Need to Create Big Datasets to Learn a Task?	https://aclanthology.org/2020.sustainlp-1.23																									
ravichander-etal-2020-systematicity	2020	On the Systematicity of Probing Contextualized Word Representations: The Case of Hypernymy in {BERT}	https://aclanthology.org/2020.starsem-1.10	Done	intrinsic	structural	pretrain-test	covariate	generated shifts	language modelling	Yanai	Dieuwke																
chen-etal-2020-reading	2020	Reading the Manual: Event Extraction as Definition Comprehension	https://aclanthology.org/2020.spnlp-1.9																									
vylomova-etal-2020-sigmorphon	2020	{SIGMORPHON} 2020 Shared Task 0: Typologically Diverse Morphological Inflection	https://aclanthology.org/2020.sigmorphon-1.1	Done	cognitive	structural	train-test	covariate	naturally occurring shifts	morphological inflection	Huygaa	Tiago																
jhunjhunwala-etal-2020-multi	2020	Multi-Action Dialog Policy Learning with Interactive Human Teaching	https://aclanthology.org/2020.sigdial-1.36																									
mahurkar-patil-2020-lrg	2020	{LRG} at {S}em{E}val-2020 Task 7: Assessing the Ability of {BERT} and Derivative Models to Perform Short-Edits Based Humor Grading	https://aclanthology.org/2020.semeval-1.108																									
pedersen-2020-duluth	2020	{D}uluth at {S}em{E}val-2020 Task 12: Offensive Tweet Identification in {E}nglish with Logistic Regression	https://aclanthology.org/2020.semeval-1.255	Flag for further review							Leila		I do not think this paper is relevant. It states that the rekeased gold data for the competition has noise in the labels and that is why powerfull methods learnin g anomalies might not generalize well. 															
cengiz-yuret-2020-joint	2020	Joint Training with Semantic Role Labeling for Better Generalization in Natural Language Inference	https://aclanthology.org/2020.repl4nlp-1.11																									
ek-etal-2020-punctuation	2020	How does Punctuation Affect Neural Models in Natural Language Inference	https://aclanthology.org/2020.pam-1.15	Done	practical	robustness	finetune-train/test	covariate	generated shifts	NLI	Tiago	Zhijing																
gao-etal-2020-machine	2020	From Machine Reading Comprehension to Dialogue State Tracking: Bridging the Gap	https://aclanthology.org/2020.nlp4convai-1.10																									
cruz-etal-2020-localization	2020	Localization of Fake News Detection via Multitask Transfer Learning	https://aclanthology.org/2020.lrec-1.316																									
ahamad-etal-2020-accentdb	2020	{A}ccent{DB}: A Database of Non-Native {E}nglish Accents to Assist Neural Speech Recognition	https://aclanthology.org/2020.lrec-1.659																									
chowdhury-etal-2020-multi	2020	A Multi-Platform {A}rabic News Comment Dataset for Offensive Language Detection	https://aclanthology.org/2020.lrec-1.761																									
grivas-etal-2020-cute	2020	Not a cute stroke: Analysis of Rule- and Neural Network-based Information Extraction Systems for Brain Radiology Reports	https://aclanthology.org/2020.louhi-1.4																									
huber-etal-2020-supervised	2020	Supervised Adaptation of Sequence-to-Sequence Speech Recognition Systems using Batch-Weighting	https://aclanthology.org/2020.lifelongnlp-1.2																									
bandyopadhyay-zhao-2020-natural	2020	Natural Language Response Generation from {SQL} with Generalization and Back-translation	https://aclanthology.org/2020.intexsempar-1.6	Done	practical	compositional	pretrain-test	covariate	fully generated/selected	NLG	Rita	Huygaa																
huang-etal-2020-counterfactually	2020	Counterfactually-Augmented {SNLI} Training Data Does Not Yield Better Generalization Than Unaugmented Data	https://aclanthology.org/2020.insights-1.13																									
kale-rastogi-2020-text	2020	Text-to-Text Pre-Training for Data-to-Text Tasks	https://aclanthology.org/2020.inlg-1.14																									
du-etal-2020-schema	2020	Schema-Guided Natural Language Generation	https://aclanthology.org/2020.inlg-1.35																									
peng-etal-2020-shot	2020	Few-shot Natural Language Generation for Task-Oriented Dialog	https://aclanthology.org/2020.findings-emnlp.17	Done	practical	across domain	pretrain-train	full	naturally occurring shifts	dialogue	Leila	Koustuv	They use a pre-traine LM (GPT2) and further pre-train it on huge labelled dialogue state data, then finetune with little samples and test on a dataset they collect															
li-etal-2020-event	2020	Event Extraction as Multi-turn Question Answering	https://aclanthology.org/2020.findings-emnlp.73																									
wu-etal-2020-improving	2020	Improving {QA} Generalization by Concurrent Modeling of Multiple Biases	https://aclanthology.org/2020.findings-emnlp.74																									
yang-etal-2020-generative	2020	Generative Data Augmentation for Commonsense Reasoning	https://aclanthology.org/2020.findings-emnlp.90	Flag for further review	practical	robustness	finetune-train/test	covariate	generated shifts	question answering	Leila	Koustuv																
welbl-etal-2020-undersensitivity	2020	Undersensitivity in Neural Reading Comprehension	https://aclanthology.org/2020.findings-emnlp.103																									
gardner-etal-2020-evaluating	2020	Evaluating Models{'} Local Decision Boundaries via Contrast Sets	https://aclanthology.org/2020.findings-emnlp.117	Done	intrinsic	robustness	finetune-train/test	covariate	generated shifts	NLI	Yanai	Verna																
gardner-etal-2020-evaluating	2020	Evaluating Models{'} Local Decision Boundaries via Contrast Sets	https://aclanthology.org/2020.findings-emnlp.117	Done	intrinsic	robustness	finetune-train/test	covariate	generated shifts	sentiment analysis	Yanai	Verna																
gardner-etal-2020-evaluating	2020	Evaluating Models{'} Local Decision Boundaries via Contrast Sets	https://aclanthology.org/2020.findings-emnlp.117	Done	intrinsic	robustness	finetune-train/test	covariate	generated shifts	question answering	Yanai	Verna																
ye-etal-2020-teaching	2020	Teaching Machine Comprehension with Compositional Explanations	https://aclanthology.org/2020.findings-emnlp.145																									
roman-roman-etal-2020-rmm	2020	{RMM}: A Recursive Mental Model for Dialogue Navigation	https://aclanthology.org/2020.findings-emnlp.157																									
lin-etal-2020-commongen	2020	{C}ommon{G}en: A Constrained Text Generation Challenge for Generative Commonsense Reasoning	https://aclanthology.org/2020.findings-emnlp.165	Flag for further review	practical	across task	finetune-train/test	full	naturally occurring shifts	question answering	Leila	Koustuv	They investigate how finetuned/trained models on comonGen can improve QA															
khashabi-etal-2020-unifiedqa	2020	{UNIFIEDQA}: Crossing Format Boundaries with a Single {QA} System	https://aclanthology.org/2020.findings-emnlp.171																									
oren-etal-2020-improving	2020	Improving Compositional Generalization in Semantic Parsing	https://aclanthology.org/2020.findings-emnlp.225																									
limisiewicz-etal-2020-universal	2020	{U}niversal {D}ependencies {A}ccording to {BERT}: {B}oth {M}ore {S}pecific and {M}ore {G}eneral	https://aclanthology.org/2020.findings-emnlp.245																									
du-etal-2020-general	2020	General Purpose Text Embeddings from Pre-trained Language Models for Scalable Inference	https://aclanthology.org/2020.findings-emnlp.271																									
yin-etal-2020-learning	2020	Learning to Generalize for Sequential Decision Making	https://aclanthology.org/2020.findings-emnlp.273																									
xia-etal-2020-composed	2020	Composed Variational Natural Language Generation for Few-shot Intents	https://aclanthology.org/2020.findings-emnlp.303																									
zhang-etal-2020-margin	2020	Margin-aware Unsupervised Domain Adaptation for Cross-lingual Text Labeling	https://aclanthology.org/2020.findings-emnlp.315																									
chen-etal-2020-cdevalsumm	2020	{CDE}val{S}umm: An Empirical Study of Cross-Dataset Evaluation for Neural Summarization Systems	https://aclanthology.org/2020.findings-emnlp.329																									
maharana-bansal-2020-adversarial	2020	Adversarial Augmentation Policy Search for Domain and Cross-Lingual Generalization in Reading Comprehension	https://aclanthology.org/2020.findings-emnlp.333	First check done	practical	robustness	finetune-train/test	covariate	generated shifts	reading comprehension	Huygaa		Table 2 - Adversarial evaluation of Roberta finetuned on SQUAD 2.0															
maharana-bansal-2020-adversarial	2020	Adversarial Augmentation Policy Search for Domain and Cross-Lingual Generalization in Reading Comprehension	https://aclanthology.org/2020.findings-emnlp.333	First check done	practical	across domain	finetune-train/test	covariate	generated shifts	reading comprehension	Huygaa		Table 4															
maharana-bansal-2020-adversarial	2020	Adversarial Augmentation Policy Search for Domain and Cross-Lingual Generalization in Reading Comprehension	https://aclanthology.org/2020.findings-emnlp.333	First check done	practical	across language	finetune-train/test	covariate	generated shifts	reading comprehension	Huygaa		Table 5															
harrigian-etal-2020-models	2020	Do Models of Mental Health Based on Social Media Data Generalize?	https://aclanthology.org/2020.findings-emnlp.337	Done	intrinsic	across domain	train-test	covariate	naturally occurring shifts	other	Tiago	Zhijing	This paper evaluates how classifiers trained to detect depression fare both across time (train in year x vs tested in year y) and across social media (trianed in twitter vs tested in reddit)															
he-etal-2020-enhancing	2020	Enhancing Generalization in Natural Language Inference by Syntax	https://aclanthology.org/2020.findings-emnlp.447																									
banerjee-baral-2020-self	2020	Self-Supervised Knowledge Triplet Learning for Zero-Shot Question Answering	https://aclanthology.org/2020.emnlp-main.11																									
warstadt-etal-2020-learning	2020	Learning Which Features Matter: {R}o{BERT}a Acquires a Preference for Linguistic Generalizations (Eventually)	https://aclanthology.org/2020.emnlp-main.16	Done	intrinsic	structural	finetune-train/test	covariate	fully generated/selected	seq2seq synthetic	Yanai	Tiago	Are you sure this should be pretrain-train? I would mark it as finetune-test, as the distribution changes from finetuning to test sets. I would also mark it as a covariate shift, as the same p(y|x) is used for finetuning and testing, but different instances x are used.															
bansal-etal-2020-self	2020	Self-Supervised Meta-Learning for Few-Shot Natural Language Classification Tasks	https://aclanthology.org/2020.emnlp-main.38																									
forbes-etal-2020-social	2020	Social Chemistry 101: Learning to Reason about Social and Moral Norms	https://aclanthology.org/2020.emnlp-main.48																									
ng-etal-2020-ssmba	2020	{SSMBA}: Self-Supervised Manifold Based Data Augmentation for Improving Out-of-Domain Robustness	https://aclanthology.org/2020.emnlp-main.97																									
weller-etal-2020-learning	2020	Learning from Task Descriptions	https://aclanthology.org/2020.emnlp-main.105																									
ponti-etal-2020-xcopa	2020	{XCOPA}: A Multilingual Dataset for Causal Commonsense Reasoning	https://aclanthology.org/2020.emnlp-main.185	Done	cognitive	across domain	pretrain-train	covariate	naturally occurring shifts	reasoning	Huygaa	Leila	Table 5 CO-ZS: multilingual LMs fine-tuned on SIQA and tested on XCOPA. Domain difference between SIQA and XCOPA. Here is only language involved, English.															
ponti-etal-2020-xcopa	2020	{XCOPA}: A Multilingual Dataset for Causal Commonsense Reasoning	https://aclanthology.org/2020.emnlp-main.185	Done	cognitive	across language	pretrain-train	full	naturally occurring shifts	reasoning	Leila	Huygaa	Table 5 CO-TLV: multilingual LMs fine-tuned and tested on XCOPA															
ponti-etal-2020-xcopa	2020	{XCOPA}: A Multilingual Dataset for Causal Commonsense Reasoning	https://aclanthology.org/2020.emnlp-main.185	Done	cognitive	robustness	pretrain-train	full	generated shifts	reasoning	Huygaa	Leila	Table 6 															
ponti-etal-2020-xcopa	2020	{XCOPA}: A Multilingual Dataset for Causal Commonsense Reasoning	https://aclanthology.org/2020.emnlp-main.185	Done	cognitive	across language	pretrain-train	full	naturally occurring shifts	reasoning	Leila	Huygaa	Adaptation to unseen languages															
xiao-etal-2020-modeling	2020	Modeling Content Importance for Summarization with Pre-trained Language Models	https://aclanthology.org/2020.emnlp-main.293																									
rosenman-etal-2020-exposing	2020	{E}xposing {S}hallow {H}euristics of {R}elation {E}xtraction {M}odels with {C}hallenge {D}ata	https://aclanthology.org/2020.emnlp-main.302	Done	intrinsic	robustness	train-test	covariate	generated shifts	relation extraction	Yanai	Tiago																
huang-etal-2020-joint-multiple	2020	A Joint Multiple Criteria Model in Transfer Learning for Cross-domain {C}hinese Word Segmentation	https://aclanthology.org/2020.emnlp-main.318																									
daza-frank-2020-x	2020	{X}-{SRL}: A Parallel Cross-Lingual Semantic Role Labeling Dataset	https://aclanthology.org/2020.emnlp-main.321	First check done	practical	across language	finetune-train/test	covariate	fully generated/selected	semantic parsing / role labelling	Huygaa		Table 6. Finetune mBERT on English and test it on DE, FR, ES. All the data was fully generated using machine translation. 															
wang-etal-2020-negative	2020	On Negative Interference in Multilingual Models: Findings and A Meta-Learning Treatment	https://aclanthology.org/2020.emnlp-main.359	Flag for further review	practical	across language	finetune-train/test	covariate	natural data splits	multiple tasks	Mikel		This paper studies negative interference during multilingual pre-training. It compares different approaches to address interference, and compare how they affect performance when fine-tuning in the target language and transfering cross-lingually (fine-tune on English, test on target language). My annotation corresponds to the latter, not sure how the former would fit in our framework (if relevant)															
philip-etal-2020-monolingual	2020	Monolingual Adapters for Zero-Shot Neural Machine Translation	https://aclanthology.org/2020.emnlp-main.361	Done	practical	across language	train-test	label	naturally occurring shifts	machine translation	Florian	Zhijing	adaptation experiments (not included in this annotation is what they call zero-shot because it is not really zero-shot in my eyes, since the source and the target language were seen already, just the translation direction is unseen)															
wilcox-etal-2020-structural	2020	Structural Supervision Improves Few-Shot Learning and Syntactic Generalization in Neural Language Models	https://aclanthology.org/2020.emnlp-main.375	Done	cognitive	structural	train-test	covariate	naturally occurring shifts	language modelling	Florian	Zhijing																
li-etal-2020-optimus	2020	Optimus: Organizing Sentences via Pre-trained Modeling of a Latent Space	https://aclanthology.org/2020.emnlp-main.378																									
chen-etal-2020-low	2020	Low-Resource Domain Adaptation for Compositional Task-Oriented Semantic Parsing	https://aclanthology.org/2020.emnlp-main.413																									
guo-etal-2020-sequence	2020	Sequence-Level Mixed Sample Data Augmentation	https://aclanthology.org/2020.emnlp-main.447																									
keskar-etal-2020-thieves	2020	The Thieves on Sesame Street are Polyglots - Extracting Multilingual Models from Monolingual {API}s	https://aclanthology.org/2020.emnlp-main.501	Flag for further review	practical	across language	finetune-train/test	covariate	natural data splits	NLI	Mikel		Unusual setup: prior work has shown that it is possible to "steal" a classifier without access to the model weights by training on gibberish input data paired with the label predicted by the victim model; this paper explores if such an approach also generalizes cross-lingually for multilingual models, using only gibberish data in English															
desai-etal-2020-compressive	2020	Compressive Summarization with Plausibility and Salience Modeling	https://aclanthology.org/2020.emnlp-main.507																									
yin-etal-2020-universal	2020	Universal Natural Language Processing with Limited Annotations: Try Few-shot Textual Entailment as a Start	https://aclanthology.org/2020.emnlp-main.660																									
stacey-etal-2020-avoiding	2020	{A}voiding the {H}ypothesis-{O}nly {B}ias in {N}atural {L}anguage {I}nference via {E}nsemble {A}dversarial {T}raining	https://aclanthology.org/2020.emnlp-main.665																									
flachs-etal-2020-grammatical	2020	Grammatical Error Correction in Low Error Density Domains: A New Benchmark and Analyses	https://aclanthology.org/2020.emnlp-main.680																									
chen-etal-2020-kgpt	2020	{KGPT}: Knowledge-Grounded Pre-Training for Data-to-Text Generation	https://aclanthology.org/2020.emnlp-main.697																									
allaway-mckeown-2020-zero	2020	{Z}ero-{S}hot {S}tance {D}etection: {A} {D}ataset and {M}odel using {G}eneralized {T}opic {R}epresentations	https://aclanthology.org/2020.emnlp-main.717																									
kim-linzen-2020-cogs	2020	{COGS}: A Compositional Generalization Challenge Based on Semantic Interpretation	https://aclanthology.org/2020.emnlp-main.731	Done	cognitive	compositional	train-test	covariate	fully generated/selected	semantic parsing / role labelling	Verna	Florian																
swayamdipta-etal-2020-dataset	2020	Dataset Cartography: Mapping and Diagnosing Datasets with Training Dynamics	https://aclanthology.org/2020.emnlp-main.746	Done	intrinsic	robustness	finetune-train/test	covariate	natural data splits	NLI	Verna	Florian																
swayamdipta-etal-2020-dataset	2020	Dataset Cartography: Mapping and Diagnosing Datasets with Training Dynamics	https://aclanthology.org/2020.emnlp-main.746	Done	intrinsic	robustness	finetune-train/test	covariate	natural data splits	reasoning	Verna	Florian																
frank-petty-2020-sequence	2020	Sequence-to-Sequence Networks Learn the Meaning of Reflexive Anaphora	https://aclanthology.org/2020.crac-1.16																									
joshi-etal-2020-taxinli	2020	{T}axi{NLI}: Taking a Ride up the {NLU} Hill	https://aclanthology.org/2020.conll-1.4																									
bhattacharya-van-schijndel-2020-filler	2020	Filler-gaps that neural networks fail to generalize	https://aclanthology.org/2020.conll-1.39																									
eisape-etal-2020-cloze	2020	Cloze Distillation: Improving Neural Language Models with Human Next-Word Prediction	https://aclanthology.org/2020.conll-1.49																									
nicolai-silfverberg-2020-noise	2020	Noise Isn{'}t Always Negative: Countering Exposure Bias in Sequence-to-Sequence Inflection Models	https://aclanthology.org/2020.coling-main.255																									
zeng-etal-2020-event	2020	Event Coreference Resolution with their Paraphrases and Argument-aware Embeddings	https://aclanthology.org/2020.coling-main.275																									
li-etal-2020-target	2020	Target Word Masking for Location Metonymy Resolution	https://aclanthology.org/2020.coling-main.330																									
bansal-etal-2020-learning	2020	Learning to Few-Shot Learn Across Diverse Natural Language Classification Tasks	https://aclanthology.org/2020.coling-main.448																									
kalouli-etal-2020-hy	2020	Hy-{NLI}: a Hybrid system for Natural Language Inference	https://aclanthology.org/2020.coling-main.459																									
geiger-etal-2020-neural	2020	Neural Natural Language Inference Models Partially Embed Theories of Lexical Entailment and Negation	https://aclanthology.org/2020.blackboxnlp-1.16																									
mccoy-etal-2020-berts	2020	{BERT}s of a feather do not generalize together: Large variability in generalization across models with similar test set performance	https://aclanthology.org/2020.blackboxnlp-1.21	Done	intrinsic	robustness	finetune-train/test	covariate	fully generated/selected	NLI	Yanai	Tiago																
thrush-etal-2020-investigating	2020	Investigating Novel Verb Learning in {BERT}: Selectional Preference Classes and Alternation-Based Syntactic Generalization	https://aclanthology.org/2020.blackboxnlp-1.25																									
newman-etal-2020-eos	2020	The {EOS} Decision and Length Extrapolation	https://aclanthology.org/2020.blackboxnlp-1.26	Done	intrinsic	structural	train-test	covariate	fully generated/selected	seq2seq synthetic	Florian	Verna	Dyck and SCAN experiments															
newman-etal-2020-eos	2020	The {EOS} Decision and Length Extrapolation	https://aclanthology.org/2020.blackboxnlp-1.26	Done	intrinsic	structural	train-test	covariate	natural data splits	machine translation	Florian	Verna	Machine translation															
haley-2020-bert	2020	This is a {BERT}. Now there are several of them. Can they generalize to novel words?	https://aclanthology.org/2020.blackboxnlp-1.31	Done	intrinsic	structural	pretrain-test	covariate	generated shifts	language modelling	Tiago	Zhijing	This task could probably be number agreement, instead of language modelling.															
rawat-etal-2020-entity	2020	Entity-Enriched Neural Models for Clinical Question Answering	https://aclanthology.org/2020.bionlp-1.12																									
nejadgholi-kiritchenko-2020-cross	2020	On Cross-Dataset Generalization in Automatic Detection of Online Abuse	https://aclanthology.org/2020.alw-1.20																									
buyukoz-etal-2020-analyzing	2020	Analyzing {ELM}o and {D}istil{BERT} on Socio-political News Classification	https://aclanthology.org/2020.aespen-1.4																									
ray-chowdhury-etal-2020-cross	2020	Cross-Lingual Disaster-related Multi-label Tweet Classification with Manifold Mixup	https://aclanthology.org/2020.acl-srw.39																									
russin-etal-2020-compositional	2020	Compositional Generalization by Factorizing Alignment and Translation	https://aclanthology.org/2020.acl-srw.42	Done	cognitive	compositional	train-test	covariate	fully generated/selected	seq2seq synthetic	Rita	Dieuwke	Even though the task mentions MT, it seems that the goal is to research compositional generalization. Datasets used; SCAN and MT dataset from teh same paper															
zhao-etal-2020-designing	2020	Designing Precise and Robust Dialogue Response Evaluators	https://aclanthology.org/2020.acl-main.4																									
chen-etal-2020-shot	2020	Few-Shot {NLG} with Pre-Trained Language Model	https://aclanthology.org/2020.acl-main.18																									
dubois-etal-2020-location	2020	{L}ocation {A}ttention for {E}xtrapolation to {L}onger {S}equences	https://aclanthology.org/2020.acl-main.39																									
rybak-etal-2020-klej	2020	{KLEJ}: Comprehensive Benchmark for {P}olish Language Understanding	https://aclanthology.org/2020.acl-main.111																									
hu-etal-2020-systematic	2020	A Systematic Assessment of Syntactic Generalization in Neural Language Models	https://aclanthology.org/2020.acl-main.158	Done	intrinsic	structural	train-test	assumed	fully generated/selected	language modelling	Florian	Yanai																
mccurdy-etal-2020-inflecting	2020	Inflecting When There{'}s No Majority: Limitations of Encoder-Decoder Neural Networks as Cognitive Models for {G}erman Plurals	https://aclanthology.org/2020.acl-main.159	Done	cognitive	structural	train-test	covariate	generated shifts	morphological inflection	Tiago	Zhijing																
goodwin-etal-2020-probing	2020	Probing Linguistic Systematicity	https://aclanthology.org/2020.acl-main.177	Done	intrinsic	compositional	train-test	covariate	fully generated/selected	NLI	Tiago	Zhijing																
talmor-etal-2020-olmpics	2020	o{LM}pics-On What Language Model Pre-training Captures	https://aclanthology.org/2020.tacl-1.48	Done	intrinsic	across task	pretrain-train	covariate	fully generated/selected	multiple tasks	Tiago	Yanai	In this paper, the authors evaluate whether roberta (and two other non-pretrained transformers) can perform 8 different tasks zero shot (through masked language modelling) and when finetuned on these tasks with different amounts of data.															
talmor-etal-2020-olmpics	2020	o{LM}pics-On What Language Model Pre-training Captures	https://aclanthology.org/2020.tacl-1.48	Done	intrinsic	across task	pretrain-test	covariate	fully generated/selected	multiple tasks	Tiago	Yanai	In this paper, the authors evaluate whether roberta (and two other non-pretrained transformers) can perform 8 different tasks zero shot (through masked language modelling) and when finetuned on these tasks with different amounts of data.															
jiang-etal-2020-smart	2020	{SMART}: Robust and Efficient Fine-Tuning for Pre-trained Natural Language Models through Principled Regularized Optimization	https://aclanthology.org/2020.acl-main.197	Flag for further review	practical						Huygaa		Really hard to say if its experiments are related to generalization. 															
zhang-etal-2020-overfitting	2020	Why Overfitting Isn{'}t Always Bad: Retrofitting Cross-Lingual Word Embeddings to Dictionaries	https://aclanthology.org/2020.acl-main.201																									
min-etal-2020-syntactic	2020	Syntactic Data Augmentation Increases Robustness to Inference Heuristics	https://aclanthology.org/2020.acl-main.212																									
